{
  "attempt_count": 1,
  "conversation_id": "conv_00000000000000000000000000000001",
  "created_at": "2026-01-01T00:20:10.000000Z",
  "finished_at": "2026-01-01T00:22:10.000000Z",
  "gates": [
    {
      "exit_code": 0,
      "gate_id": "patch_diff_check",
      "output_tail": null,
      "reason_code": null,
      "status": "passed"
    }
  ],
  "green_head_commit": "00453073136862e5d1fc1ca442f5f7fcc5344532",
  "integration_id": "boardintegration_00000000000000000000000000000020",
  "items": [
    {
      "applied_verification_id": "boardverify_00000000000000000000000000000019",
      "conflicts": [],
      "conflicts_total": 0,
      "module_id": "m1",
      "order": 1,
      "role": "newcomer",
      "status": "applied",
      "verification_id": "boardverify_00000000000000000000000000000019"
    }
  ],
  "reason_code": null,
  "result_commit": "00453073136862e5d1fc1ca442f5f7fcc5344532",
  "schema_version": "room_board_integration/v1",
  "status": "integrated"
}
