{
  "attempt_count": 1,
  "conversation_id": "conv_00000000000000000000000000000001",
  "created_at": "2026-01-01T00:50:10.000000Z",
  "finished_at": "2026-01-01T00:52:10.000000Z",
  "gates": [
    {
      "exit_code": 0,
      "gate_id": "patch_diff_check",
      "output_tail": null,
      "reason_code": null,
      "status": "passed"
    }
  ],
  "green_head_commit": "146fa446e9c4c463b33c542b25dd58423a5bd630",
  "integration_id": "boardintegration_00000000000000000000000000000034",
  "items": [
    {
      "applied_verification_id": "boardverify_00000000000000000000000000000021",
      "conflicts": [
        {
          "attributed_module_ids": [
            "m1",
            "m2"
          ],
          "path": "docs/shared.txt"
        }
      ],
      "conflicts_total": 1,
      "module_id": "m1",
      "order": 1,
      "role": "newcomer",
      "status": "conflicted",
      "verification_id": "boardverify_00000000000000000000000000000030"
    },
    {
      "applied_verification_id": "boardverify_00000000000000000000000000000027",
      "conflicts": [],
      "conflicts_total": 0,
      "module_id": "m2",
      "order": 2,
      "role": "incumbent",
      "status": "applied",
      "verification_id": "boardverify_00000000000000000000000000000027"
    }
  ],
  "reason_code": null,
  "result_commit": "146fa446e9c4c463b33c542b25dd58423a5bd630",
  "schema_version": "room_board_integration/v1",
  "status": "integrated"
}
