{
  "attempt_count": 0,
  "conversation_id": "conv_00000000000000000000000000000001",
  "created_at": "2026-01-01T00:50:10.000000Z",
  "finished_at": null,
  "gates": [],
  "green_head_commit": "4de3cad90d3e6dff5c997ae073ddfc925977e14a",
  "integration_id": "boardintegration_00000000000000000000000000000034",
  "items": [
    {
      "applied_verification_id": null,
      "conflicts": [],
      "conflicts_total": 0,
      "module_id": "m2",
      "order": 1,
      "role": "incumbent",
      "status": "not_applied",
      "verification_id": "boardverify_00000000000000000000000000000027"
    },
    {
      "applied_verification_id": null,
      "conflicts": [],
      "conflicts_total": 0,
      "module_id": "m1",
      "order": 2,
      "role": "newcomer",
      "status": "not_applied",
      "verification_id": "boardverify_00000000000000000000000000000030"
    }
  ],
  "reason_code": null,
  "result_commit": null,
  "schema_version": "room_board_integration/v1",
  "status": "pending"
}
