{
  "attempt_count": 1,
  "conversation_id": "conv_00000000000000000000000000000001",
  "created_at": "2026-01-01T00:50:10.000000Z",
  "finished_at": "2026-01-01T00:52:10.000000Z",
  "gates": [
    {
      "exit_code": 0,
      "gate_id": "patch_diff_check",
      "output_tail": null,
      "reason_code": null,
      "status": "passed"
    }
  ],
  "green_head_commit": "ff0ab9c897aa976f732cc6fee3cacb38cad85cbe",
  "integration_id": "boardintegration_00000000000000000000000000000034",
  "items": [
    {
      "applied_verification_id": "boardverify_00000000000000000000000000000027",
      "conflicts": [],
      "conflicts_total": 0,
      "module_id": "m2",
      "order": 1,
      "role": "incumbent",
      "status": "applied",
      "verification_id": "boardverify_00000000000000000000000000000027"
    },
    {
      "applied_verification_id": "boardverify_00000000000000000000000000000021",
      "conflicts": [
        {
          "attributed_module_ids": [
            "m2"
          ],
          "path": "docs/b.txt"
        }
      ],
      "conflicts_total": 1,
      "module_id": "m1",
      "order": 2,
      "role": "newcomer",
      "status": "fell_back",
      "verification_id": "boardverify_00000000000000000000000000000030"
    }
  ],
  "reason_code": null,
  "result_commit": "ff0ab9c897aa976f732cc6fee3cacb38cad85cbe",
  "schema_version": "room_board_integration/v1",
  "status": "integrated"
}
